chapter,verse,sanskrit,translation,source
1,1,अथ योगानुशासनम्,"Now, the instruction of Yoga begins.",Yoga Sutras
1,2,योगश्चित्तवृत्तिनिरोधः,Yoga is the settling of the mind into silence (cessation of mental fluctuations).,Yoga Sutras
1,3,तदा द्रष्टुः स्वरूपेऽवस्थानम्,Then the Seer (Self) abides in Its own true nature.,Yoga Sutras
1,4,वृत्तिसारूप्यमितरत्र,"At other times, the Self appears to take the form of the mental modifications.",Yoga Sutras
1,5,वृत्तयः पञ्चतय्यः क्लिष्टाक्लिष्टाः,"There are five kinds of mental modifications, which are either painful or painless.",Yoga Sutras
1,12,अभ्यासवैराग्याभ्यां तन्निरोधः,The mind is mastered through practice (Abhyasa) and non-attachment (Vairagya).,Yoga Sutras
1,13,तत्र स्थितौ यत्नोऽभ्यासः,Practice is the sustained effort to rest in that stillness.,Yoga Sutras
1,33,मैत्रीकरुणामुदितोपेक्षाणां...,"The mind becomes serene by cultivating friendliness, compassion, delight, and equanimity toward all.",Yoga Sutras
